Mar 2020,50,Week end in Livigno,"Amazing hotel, amazing staff, from the Receptionist till floor waitres.Was one wonderfull Experience, we felt at home, Room was beatifull and big with an amazing view, clean and silent, all staff was smiling.The SPA was special, swim in pool near to the snow Is an incredible Experience.I want to thank Mr Mauro, Ms Fogu, Mr Armando and his collaborator. And all the staff.Massimo Zolo"
Feb 2020,50,Once in a life time experience,"A fantastic weekend spent in an igloo. A unique and personalised experience. The staff were attentive and friendly. The only suggestion to other couples would be to ask for a private dinner instead of being put with another couple . Other than that, just brilliant and unforgettable."
Jan 2020,50,"Excellently manged friendly, clean relax-hotel with superb service!!","Relax-hotel directly situated at the ski-slopes. Offers very clean, spacious rooms, extremely attentive and friendly professional personell, first class suisine, The stay here (4 nights) was an excellent experience in every respect and we already enjoy to be guests in this Hotel again!! We can give a wholehearted recommendation without any restriction! Come and see yourselves."
Jan 2020,50,Generous hospitality ,"Even before we arrived we felt welcome at Hotel Lac Salin. We called ahead to organise a few things and everything is made easy by the helpful and welcoming staff at this ski in/ski out resort. Our rooms were gorgeous and an upgrade to a suite was very much appreciated. The spa and wellness centre is new and the attention to detail is incredible. Staff are at the ready to assist and the hotel policy appears to be based on generosity. The breakfast buffet and half board dinners were of a very high standard. The dinner was called a buffet but the entree and mains were ordered from a menu with a choice of three. The appetisers and dessert were via the buffet. Room service attention in the evening ensured that we had plenty of towels for the pool, salt pool and saunas. It was very hard to leave this fabulous hotel. Can’t speak highly enough of this experience."
Jan 2020,50,Super easy ski holiday hotel destination!,"The Hotel Lac Salin is well positioned in Livigno and can’t be beaten in terms of ease of stay. True ski in and ski out. First lift and lift pass office couldnt be more than 30 mars away. Ski hire located in the base of the boot room (all within the hotel) and ski in/out access from there. Our stay included half board, so breakfast and dinner. Quality of the food was great and I particularly liked the abundant salad bar and other assorted antipasto  to begin each evening meal with. Breakfast too was bountiful with eggs made to order available, as well as espresso coffee. The wait staff were amazing. So accommodating and they even came to the rescue of my daughter who nearly fainted one morning at breakfast. They also provided a lovely cake and happy birthday singing for my son. My only comment would seemed a little strange and disappointing to be charged for water (only at dinner) when everything else except alcohol was included at other times. In fact at breakfast there was even champagne available as part of the buffet. The rooms are well appointed and comfortable, although I did find the mattresses rather firm. The use of extra facilities such as the pool, gym, sauna and steam baths which are included in your stay are amazing and the couple of massages we had in the spa (paid for) also hit the spot!I feel a little guilty that I didn’t see too much of Livigno town itself because everything we needed was taken care of in the hotel! Management was lovely as were the ladies cleaning our rooms. All in all, a great stay and one Id highly recommend."
Jan 2020,50,Fantastic time in Livigno,"It’s our final day at the Lac Salin hotel but we have had a fantastic time here. The hotel is absolutely stunning. It’s situated right next to the piste and lifts, so getting out skiing everyday is very easy. The rooms were large with very comfortable beds and a great balcony to enjoy a drink on later in the day. The staff at the hotel were so welcoming and could not do enough to help you out. Finally the best thing about the hotel was the food! We had planned to eat out more but in the end we never wanted to miss out on the four course dinners each day!This is a great hotel to stay in if you are considering coming to beautiful Livigno."
Jan 2020,50,Loved the Snow Dream Experience!!!,"A staff member Rosita showed us the hotel and was extremely helpful, accommodating and knowledgeable! We ended up staying here in the snow chalet for the snow dream experience. It was such a breath taking place to stay. The thermal sleeping sleeping bags they gave us and the heating bags kept us toasty warm all night! They even brought us wine and tea before we hopped into bed and again brought us tea in the morning before taking us into our private breakfast area. We had access to the spa bathrooms all night as well so when we needed to use them we could easily go inside. In the morning after breakfast we had amazing spa and massage treatments. I absolutely love this place and think everyone should try the snow dream experience!!!!!"
Dec 2019,50,Such a beautiful place!,"It was our 3rd time staying at the Lac Salin in Livigno and it gets better every time.Livigno itself is wonderful and the Lac Salin is the perfect place to stay.The welcome, as before, was warm and friendly and it really feels like each member of staff is pleased that you are there.The food and the service from in the restaurant was fantastic and the dinner on Christmas Eve was special!The bar staff were also great and took pride in serving you, whether it be a pasta dish for lunch or a Moscow Mule in the evening.The location was perfect with the ski school on the doorstep and only a short walk into the centre of town.If I have one suggestion for improvement it would be the showers in the rooms. The shower heads are tiny and very difficult to control, which can lead to water going everywhere. Only a small point and did not affect our stay.One of the best parts of this trip was using the expanded Spa area. This was wonderful! From the new salt water jacuzzi pool to the fantastic swinging beds. It is luxurious and we loved it!In summary, this is a superb hotel with a lovely welcome in an ideal location with great staff! I did not want to leave and will certainly return!"
Dec 2019,50,The best hotel I've stayed in,"The hotel is pretty big, not what I usually enjoy on a snowboarding vacation, but I have to say everything was to my liking.The location is ideal. You are about 10 minutes on foot till Carosello 3000 gondola - or you simply use the T-bar lift 18 (Doss) from right above the hotel and then you can get to the gondola on the slope. Ski-out and ski-in are a big plus.The buses stop almost in front of the hotel, there's supermarkets, various shops and even restaurants/bars in the vicinity (if you want some variation).The rooms are spatious, warm, modern and newly-furbished. Bed offers excellent sleep quality.The wellness area is fabulous - with various places where one can unwind after a day on the slopes. Of course, the hotel offers everything to make this experience enjoyable.The food is excellent and the service is extremely fast, friendly and efficient. You always expect good food in Italy, but here it was varied, very tasty, in abundance and served fast and with a smile on the face.Check-in/out were efficient and the reception staff was helpful.The small goodbye gift was a nice touch.The sole small minus was the bad quality of the wi-fi connection (it was fast, but was consistently inconsistent). But in today's world, everybody has many Gbs of roaming traffic, so it's a non-issue.Will definitely come back."
Dec 2019,50,Perfect  stay,"very  good  quality  of  service,  great  location  regarding the  slopes  ,  fantastic food, room with  a  lot of  space and a  great  view of the mountains,  life music  at  the  bar in  the  evening, very  nice  and  helpful staff"
Sep 2019,50,A fabulous find with luxurious Spa,"I knew I was staying in a small town in the Alps. But what I didn’t know was how the hotel not only had such spacious, relaxing and comfortable rooms with views of the mountains they also had the most beautiful SPA area I have ever seen or used and I’ve seen a lot of them.  Let’s start with the staff.  The desk clerk Jurgita went completely out of her way to make our stay one of the best on our tour of the Alps and Dolomites.  She spent time going over maps with us of the town, the area, and even plotted our trip to Milan as some roads had been closed.  We loved the restaurant she sent us to.   It was quaint and the food was fantastic.  The hotel was very clean.  It is quite modern but had that ski lodge feeling."
May 2019,50,Amazing hotel for Family and Adults !,"I never write reviews. But I have to for this one.This is amazing hotel. The best parts are: --Location  20 meters to ski lift. You can literally ski into ski room. You do not have to carry any of   your skis around. That makes massive difference if you have kids and you have to   help them with skis and boots. There is also a ski rental in hotel if you want.    I could wake up at 08:00 take the lift nr 18. , ski to Gondola, go all the way to top  and ski back in around 30-40 minutes. That is amazing.  It is also very close to shops, restaurants, church and bus stop.  Also Trauma Clinic is 100m away if you need it. (We did need it :-(  )--Staff  People that work in Lac Salin make you feel like you are part of one big family.  The Director took us for snow walking trip with wine and cheese (thank you Mauro).   He was very helpful when my wife broke her leg. He even offered some free SPA to keep her busy!--Food  Every day 5 star meal in the evening with full waiter service. I would highly   recommend half board !!--Spa and swimming pool.    There are 3 different saunas. And good size swimming pool.Most of the guest I have spoken to in the hotel have been coming back for years. Some of them 7, 10 or even 12 years!Enjoy!"
Apr 2019,40,Perfect hotel for ski,"I spent a 10 day stay in this superb hotel on the slopes.  Telesales and ski school are located next to the hotel.  Pretty large room, modernly furnished and comfortable.  From the balcony you can see the mountains and the ski slopes.  The hotel is located 10-12 minutes walk from the center.  The bus station is located 100 m from the hotel. Breakfast and dinner are of excellent quality.  good coffee.  the services are impeccable.  Spa area and swimming pool are at the highest standards.  The bar is a nicely decorated and have a goog area for smokers.This hotel deserves the note 10. I will come back with great pleasure."
Apr 2019,50,"Excellent, hidden gem","Stayed for four days for spring skiing. First time in the area and will be back both to the area and to the hotel. Superb place. Friendly staff, perfect location and excellent rooms: clean, well laid out. Great village and restaurants nearby if you want a break from hotel meals."
Mar 2019,50,Best hotel in Livigno,"This 4-star hotel has done almost everything right. Ski rental in the same building, a short walk to the ski lifts, friendly English speaking staff, great food, comfortable rooms, good cleaning. Don’t miss ordering a Martini in the bar.The only downside I can think of is that the hotel does not have a shuttle service to the slopes on the other side and that the hotel WiFi is somewhat slow."
Feb 2019,50,Perfect location for out ski holiday,"Myself and my husband stayed in the Lac Salin for our weeks ski holiday in January.  What can I say?  It was wonderful.After a long transfer, being met by very efficient reception staff and offered a welcome drink on arrival was a lovely start to our stay there.Due to booking through a tour company we were expecting our room to be of an adequate standard, it well exceeded our expectations.  The room was very spacious with fantastic views down the valley from a spacious balcony, which we didn't get to use because it was so cold.  The room was very clean with every thing you needed for your stay, tea and coffee refilled daily and a mini bar if you should so wish to use it.What can I say about the staff except they were all wonderful.  The waiters and waitresses in the restaurant were very efficient and polite.  The bar staff were great in particular Elia, he was very welcoming and very informative in particular about the gins.  The food in the hotel could not be faulted, it was fresh and very tasty.  The bar also had a very extensive cocktail menu.This hotel is definitely the best hotel we have ever stayed in on a skiing holiday and we would not hesitate to go back there.Exceptional sums the place up."
Jan 2019,50,great hotel ski in ski out,"thanks a lot for a wonderful stay at your hotel. hotel provides end to end one stop shop ski experience.very friendly & helpfull staff. wonderfull spa with many treatments. our car diesel froze in our last day and the manager came to our help immediately, called a tow truck and helped us resolved the problem immediately and even drove us to the garage for free. could not ask for a better experience...thanks a lot lac salin! will sure come back and recommend!!!"
Dec 2018,50,Perfect ski hotel !!! ,"This is perhaps the best hotel in Livigno, exceeded all our expectations, excellent position, ski out in the hotel, clean and comfortable rooms, very friendly staff, excellent food and diverse, spa and wellness perfect, I would especially like to thank the owner of the Fabia Hotel and manager Maura, this is definitely our choice and the next time we reach Livigno, thank you for having existed."
Aug 2018,50,Just loved it,"I might just have been lucky, but what a room, it had anything i could’ve wanted. It was a very pleasant stay. Kind and friendly staff that provided a great service. Fantastic location with view to the mountains and downtown Livigno. Great hotel restaurant."
Aug 2018,50,Spectacular,"We spent a fantastic week here, for skiing and relaxation. Nothing is too much trouble for the staff. The rooms are first rate and the ambiance is simply perfect. I have had 10 skiing holidays in Livigno, in a variety of hotels and first came to Lac Salin about 4 years back, nothing comes close, for all round perfection. Although the hotel is fairly new, it has lots of character. If you enjoy quality look no further. The leisure facilities are equally top class and to top it all off, we (me and the delightful Mrs) had a fantastic morning snowshoeing with the hotel guide, Fabio. We cannot wait to go back again."
Aug 2018,50,Outstanding!,"The hotel was booked via cycle tours. We stayed 3 nights, cycled to Sondrio and stayed again 3 nights. Nicola gave us excellent sugestions for race bike trips. Stelvio, Mortirolo....The hotel staff welcomed us warmly. The room with balcony was clean, spacious with a bathroom with bath and shower. The dinners were worth a Michellin star as for the breakfast! The waiters and waitresses were friendly, polite and serving. And there was more....a spa with swimming pool, sauna etc.etc. All clean, tastefully furnished. Our bicycles were safely locked. We enjoyed a perfect stay at Hotel Lac Salin. A place to return to."
Aug 2018,50,Great base for summer mountain hiking/biking in Livigno,"Great place, superb restaurant, large spa area with pool, saline bath, bubble baths,... Staff is very helpful and greatly contributes to make your stay an enjoyable one. Breakfast buffet as a choice for everybody, evening restaurant (we warmly recommend staying half-board) is offering an every day chaging menu of great italian food. Big garage where you can clean an store your bikes. Nothing to change, we will be back!"
Jul 2018,40,too expensive for the quality,you need bus to go skiing. It is too expensive and not such good for the money. Rooms are good and big and spa is good also except it is too fancy. I would prefer good italian food not such fancy  as at theese restorant
May 2018,50,Unsurpassed levels of hospitality,"Have never experienced the level of service, communication and warmth as we experienced at this hotel. The rooms are crisp and clean as often found in mountain resorts and there are two restaurants to choose from when dining here. Very light too although personally I found the mattress too hard. Next time I would ask for a top layer which would help.We were with a large group for the Ghiacciodromo (also amazing!) and with another party who also gave this hotel 7 stars! The food was prepared especially for the group dinners and I found the level to be better than when dining privately but there are plenty of food dining options in this charming Ski town resort.There is also a car park below the hotel and they have a Spa which we did not have the opportunity to try as we were away all day. When we next visit the ice track (about 20 minutes drive) we will definitely consider staying here.The hotel is very well situated for the town."
Mar 2018,50,Ski holiday 2018,"This was our seventh year at Lac Salin and it was as wonderful as ever!  The rooms, facilities (particularly the first class spa area) and food are excellent, but it is the friendly staff at this family run hotel that make the experience special.  We hope to return for many years to come!"
Mar 2018,50,Winter Ski,"Perfect hotel, perfect staff, perfect location for the ski. Simply PERFECT :) Room was cleaned 2x per day, location exelent, breakfast perfect and if you wanna go shopping you can take free bus or taxi just for 10,- Eur for a drive..."
Mar 2018,50,"Outstanding place that absolutely exceeds your expectations, hotel, where anything is possible","If you are looking for the best accommodation and stunning traveler experience, you should definitively stay in hotel Lac Salin. Either you are coming during winter or summertime, here in the heart of Livigno valley, you will find all you need. Enjoy the sun while drinking your coffee on the hotel terrace, situated directly on the slope which changes to bikers and tourist paths in summer. Relax in the spacious and cosy spa, where you can choose from salty massage pool, herbal bath, saunas and much more. Grab a tea and immerse yourself in the calming atmosphere in relaxing zone. Try the selection of delicious local as well as international culinary dish. The staff is always happy to recommend you the best wine that fits with your meal. Finish your dinner with fine desserts and don't forget to visit the bar, where you can listen to live music. If you are looking for extraordinary experience, join the hotel activities, such as yoga, fat, and e-bikes or explore the cross-country tracks. However, the place wouldn't be so special without the ''vibe'' it has. The effort, friendly and individual approach, that each employee treats you with. Even though there is anything to complain about, if you have any personal difficulties, there is always someone to immediately help you. We have visited hotel Lac Salin more than 10 times and we have to say, that there are improvements in services as well as in facilities every year. Improvements that leads to perfection. Iva, Blanka, Mirek"
Mar 2018,50,"perfect location, great service","We found the hotel just by the chance on internet and we were happy! Livigno is very long and that hotel has a super location as to the shopping, just walking distance, and for skiing. Just behind hotel there is a lift from which you can reach a new cabin-lift and go for all slopes. ANd back from skiing you wil just enter the door of ski room.Perfekt food, nice bar and very friendly and helpfull staff, especialy Giuseppe at the bar - if you need any advice or help, ask him! The whole area is perfeft for kids, nice slopes, wide, amazing."
Mar 2018,50,great location and great staff,"Excellent location , large and comfortable rooms  . Good breakfast and dinner , excellent wine list . Relaxing pool and SPA . All the staff make you feel at home . Overall an excellent stay . Will definitely be back next year"
Feb 2018,50,"Great service, great food and wine list (very fair prices)",Nicely located ski in / ski out. Not in the center of the city but 7 minutes away by taxi. Great service and our half board was perfect - good variation and very fair wine prices with an excellent wine list catering for all ...
Feb 2018,50,Lovely Stay,"I loved my stay at Lac Salin. The rooms were clean, spacious, very comfortable, and the amenities everything I could require. Great food in the hotel restaurant too. The spa in particular was lovely, especially the hydro pools. What really stood out for me was the service - very personal touch, friendly and accommodating, and that is what made it the perfect stay for me. The staff and management really made a huge effort to do what they could for guests. I would definitely stay here again!"
Jan 2018,50,Very nice hotel,"As a frequent traveller around the world I can only say that this hotel and the restaurant inside are really nice. Rooms are big, soundproof and the staff is dedicated. Regarding the restaurant, we booked half board for the 4 days and we had dinner like in a big restaurant. All the dinners were tasty and we choose some good wines at affordable prices. One thing to be ameliorated could be noise in the restaurant, but apart from this I can only recommend"
Jan 2018,50,Excellent location and service,Great location with direct access to the skiing area. The room was excellent with a great view to the mountains and the city. The personal was friendly and very service minded. Ski hire in the hotel was great
Jan 2018,50,"Great stay, great food, Great area for both skiing and in the summer time","Great hotel with great food, wellness area - and a fantastic weather for skiing. Also great in the summertime - the area offers so many possibilities.Nice service and a great atmosfare. However - the only thing is, that we where missing the former guide - Filippo !"
Jan 2018,20,Awful New Year dinner and food,"1. Rooms are clean.2. Location of the hotel is good.3. Speed of check-in and check-our was unacceptably low. Also the receptionist by mistake gave our passports to the other family that travelled with us. This was discovered only after my inquiry on a he passport issue. This is absolutely unacceptable. 4. New Year dinner was a complete disaster. We went to sleep absolutely hungry. Also we needed to order French fries and chicken for kids in addition to the New Year menu to feed them. As the result, the mood was spoiled. We regretted a lot, that our two families had to spend the New Year evening in Lac Salin.5. In general the quality of food in your hotel is bad. Surprisingly for Italy neither variety nor taste was good. Only one of every 3 dishes tasted good.6. The spa and water area is good. We enjoyed several visits there. What we didn’t like is that when we used the second lift in the rear of the hotel to come from the room to spa and back it was really cold there. Unacceptably cold as for people who are traveling with wet hair back to their rooms. Massage treatments were good.When we gave the hotel review, instead of apologizing and taking steps to improve the quality of service in the future, the hotel manager wrote that he disagrees with everything and blamed our kids for “spoiling the mood of other guests, as they were running around the restaurant”.To sum up: good location, bad food, spoiled New Year, narrow-minded, lazy and completely unprofessional management.If you stay there for skiing, do not buy their half board, as there are tens of good restaurants just around the corner."
Dec 2017,50,Exceptional!,"We spent the last week at the wonderful Hotel Lac Salin.We are beginner skiers and could not have chosen a better location. You can rent ski’s/ski equipment from the hotel. The ski school and baby slopes are 20m away. The hotel is clean, comfortable and the service incredible (the owner even carried our bags to the bus when we left!)The food was delicious with many options for vegetarians.The new spa opened whilst we were at the hotel. It has wonderful facilities (sauna, steam room, salt bath, jacuzzi, pool) that are perfect to ease your sore body after a day on the slopes.Our room was well equipped with a very comfortable bed and great linen and had stunning views of the slopes.We cannot wait to return!"
Dec 2017,50,Excellent service,"We stayed with our little family for the past five days. All the Lac Salin crew are very service-minded, helpful and caring for your pleasant holiday! Great breakfast and diners. We certainly come back!"
May 2017,40,Classic ski hotel .,"Rooms are huge , modern and comfortable and spa is with standard options .In the short it it classic ski hotel in mountain , which when you selected you will be not disappointed but also not surprised ."
Apr 2017,30,Safe choice but expensive during high season,"Rooms are spacious enough for 2 persons. Bed comfort is ok, but no pillow choice.Small tv, and very slow internet is a let down for a hotel of this standard. Streaming is nearly impossible.Bathroom : bath with shower and double sink. Toilet in bathroom. Between bathroom and bedroom is a glass wall... so  putting on the light at night wakes up the room. Bit strange...Spa is complete, swimming pool is noisy.Compact fitness.Restaurant : great breakfast, salad bar and dessertbar. The main courses are a lacking taste.Sun terras next to bar.Good ski cellar with service center.Staff and management is very friendly and helpfull : 10/10.Connection to carosello 3000 next to hotel, busses stop almost in Front of hotel.Prices are premium during season... which makes me quoting this as average."
