Mar 2017,40,Great location!,Ski in and Ski out! (To the children's area)Good lunch.Great place for a coffee when you're kids are at ski school.To far from the city center for my taste.But a perfect spot if you have small children.
Mar 2017,50,TUTTO BENE!,"Location, location, location + big room with the super view, delicious food, amazing staff and great ski rental. Extremely helpful and sufficient reception (special thanks to Christina). Comfortable underground parking with self service car wash. The best ski hotel ever. It was our 3rd time in Lacsallin and plan to come back every winter."
Mar 2017,50,Very friendly staff and awesome hotel altogether,"I had a chance to visit this hotel twice within one month and both times I was impressed by the staff. Everyone is greeting you with a wide smile everywhere you go and it doesn't look that they are pushing it. They just look generally excited and feel that they care especially the manager himself. And I believe that's they key here as the manager has employed like-minded people. For example, I had to arrive at 8 PM but was running late and they called me to ask if everything is OK(you can check-in 24/7 and that's not an issue, they were just worried that I might get lost or something), if I need any guidance etc. I missed the dinner the day I arrived but they prepared some cold dish and left in my room. This is just one example but there were many occasions when staff goes above and beyond to help you. The hotel is children friendly but it comes with noise. So if you want to enjoy silence in pool, dinner, hallways or anywhere else this hotel might not be for you. I generally like this kind of noise since it makes everything more alive. Food is great, even a special menu for vegetarians (I am not one but it is good to know) which is something you don't see too often. SPA area is well maintained and it has everything you might want. One major drawback is Wi-Fi which is very, very unstable. First time I stayed I had a room on the side where I had a good cellular connection (prepaid TIM data card), so I used that instead but during the 2nd stay, cellular wasn't an option in my room which was a bit upsetting. Really hope that they can work out Wi-Fi problems but other than that I highly recommend this hotel to everyone."
Feb 2017,50,Great Hotel with superior service,"We stayed here for a week for ski vacation in February. Hotel is great, service is fantastic and the spa is beautiful. Rooms are modern and light and the staff is so helpful. The food is good, we had some great meals and some that was more average, but there are plenty of options for dinner.Extra thank you for the help we got when our son got sick during our stay, that's the kind of service that makes the difference between a good and a great hotel 👍"
Jan 2017,50,"6 stars, seriously!","We travel quite a lot both for business and pleasure, but have never ever, anywhere in the world come across a hotel experience like this one.The rooms are large, modern, up to date. The hotel offers a parking garage on premise at no additional cost.We had two different rooms (as we decided to extend our stay, and both had great views of the mountain and of Livigno.The hotel has ski in/ski out and a ski renting and service center as well.Admission to the spa (14 years minimum age) is included in the price and it is great (Steam bath, Finnish sauna, and herbal/aroma sauna), plus a decently sized pool with various massage jets and a jacuzzi where kids are allowed till 16:00.Housekeeping was great and included turndown-service at night.We had half-board, consisting of a generous buffet of starters followed by two main courses and a dessert buffet that varied every night. Breakfast too had everything you could wish for, in great quality (including an ""omelet""-station, juicer, etc. etc.). The hotel also has an other restaurant where we dined one night which was a super-cosy alpine-style ""stube"" and where the food was as good or better as in the half-board, and the servings were enormous. Both restaurants also had an excellent wine list So... all in all, it's a great hotel in a beautiful localtion, that in itself would make me rank it ""5 stars"" (despite their own rating of ****S), so why the title ""6 stars..."" on this review?Because of the people. Oh my God. Even in 5 star hotels in Asia we have never experienced such amazing service. EXCEPTIONALLY courteous and acutely attentive. When my wife needed medicine, the reception offered to go to he pharmacy for her!From day to day, they remembered your preferences and brought you what you needed before you'd even asked for it.I could go on and on, but I think you get my point :-)Although all staff was great, some stood out and deserves special applause: Dimitrios (greatest waiter we ever had), Andrea (second greatest ;-), Alessandro (restaurant manager(?) who was fast and everywhere and nothing escaped his attention), Daniele, Pasquale, everyone on the reception, and finally Mr. Bortolotti (hotel manager) whose personal attention, active participation everywhere and friendliness was second to none.I urge anybody visiting Livigno to do themselves a favor and stay at the Lac Salin.We will, when we return to this area!"
Jan 2017,50,New Year Celebration,"We stayed at Lac Salin for 3 nights, a family of 4 including two young children, and were lucky to celebrate the new year at this special place. Livigno is a beautiful town with great restaurants, friendly peope and every possible sport for every season.Lac Salin...This is not a 4 star hotel, it's a 10 star hotel. This is a true boutique hotel. Modern and convenient yet full of character and local ambience. Every detail is thought of and made to perfection. The staff is extremely professional, friendly, hard working and going out of their way to help in any possible way. No request is too much. Especially Daniele and the entire team at the restaurant with whom we spent three magical evenings. The new year GALA was really special.  The food is outstanding, beautiful, tasty and generous. The views of the snowy mountains from our balcony were great. and the fireworks at the snow. The Ski room, ski rental, SPA, everything is perfectly arranged and equiped according to the highest standards. Kids are very welcome. We felt at home. Will definitely come back. 3 days is not enough."
Dec 2016,50,1st family Xmas away - Prestige Room - ,"This was our first Xmas holiday so thought we'd try skiing and were beginners apart from my husband! It was amazing this hotel is directly on the slope for beginners and has easy access to the other slopes where you can catch the gondola or chair lift for many more challenges. We were travelling with Neilsen so helped us arrange lessons and equip hire etc so everything was on our doorstep! Ski Teachers were very patient and really good. The hotel and staff were amazing everything is perfect and they can't do enough for you. Definitely worth their 4+ stars. Felt very special to be a part of their extended family for this week and we will return! The prestige room was lovely and had enough room for the four of us. Our girls are 7 & 12. Bear in mind there are only around 5 English channels on the tv with no DVD player or sky box (as shown in pics) these English channels are all news! So bring already downloaded films with you if you like a bit of quiet time in your room for half hour before dinner! As dinner is at 7pm which is quite late for us anyway!! 6pm would have been much better and made quite a difference to us. The Xmas eve gala dinner was fabulous, but was also very late as food didn't get out until about 8.45pm by which point we were all ready for bed, the kids were already too tired and very hungry...the menu was also a bit adventurous for the children so they didn't eat much and went away still a bit hungry! It probs would have been better to have fruit salad for starters for them and then simple pasta and roast chicken dishes thereafter just for kids otherwise it seems a bit of a waste of all that beautiful food! Santa also visited the children on Xmas eve and handed them their presents (previously sneakily handed in to reception) which was very magical.  However it would have been nice for other parents to stick to normal parent Santa rules of one present per child and also presents for children only (it's very confusing when other kids are getting way more than one and also adults are getting four or five too, which is a waste of time and then the questions of why did their own parents not get anything from Santa starts happening and gets tricky to explain!) it would be helpful if reception could stipulate this in future for everybody's sanity! However these minor blips did not spoil our time as we will definitely return again. We flew to Innsbruck and had a nearly 3 hour transfer each way which was pretty seamless each way. We were lucky with the weather and the snow cannons were creating snow every night and lorries / machines continually working to ensure there was enough extra snow to ski on, which did not disappoint as there was more than enough. Shopping in livigno town was very good and moncler outlet was brilliant all staff were very helpful and spoke English! You have to try a bombardino if you visit too! Spa facilities were fabulous, only steam room missing is a salt room and my life would have been complete lol! But you can't have it all aye! Swimming pool was also lovely and always quiet even when my girls were in there. :-). Can't recommend this place enough! We were also lucky enough to be there while they were filming and taking photos and were given usb's to take home for us to watch at our leisure which tells the lac salin story beautifully including all of the extra activities the hotel put on over Xmas. We were half board so breakfast and dinner were included every day. Apart from any drinks at dinner. There are a few local supermarkets a couple of mins walk away for water and snacks etc. The town is about a 20-30 min walk but the buses are always free to use and frequent so was never a problem actually preferred being a bit away from the town as less busy. The hotel had built an ice bar and snow lounge outside which was really cool too!"
Oct 2016,50,Amazing customer service,"If only all hotels had customer service like this. The hotel staff went out of their way to make our stay as comfortable and relaxing as possible. The food was incredible, the views of the valley is stunning and the location in this small town is fairly easy to reach most places. Stay here, you cannot go wrong."
Oct 2016,50,Very relaxing weekend in a nice atmosphere ,"We did visit the hotel for a long weekend. The staff is very friendly and helpful, the room was clean and well equipped. The hotel offers also a charging infrastructure for a Tesla which is quite nice.The breakfast is very good with a large selection on local food. We did also had dinner in the hotel which is good with a large wine selection for a very decent price. The hotel is a bit outside the main area but within 5-10 minutes walk this is not an issue.We will certainly return next time we are in Livigno."
Sep 2016,40,Thomas O'Leary,"4th returning. Absolutely brilliant customer service from arrival to departure. Excellent food, weather and amazing walks and activities. Food was world class.... as usual. Put Livigno on your bucket list and ""just go there"" you will NOT regret it!"
Sep 2016,50,Livigno 2016,"Lac Salin always very very good. You can't go wrong in a special Hotel like this. From there you can easily reach the top of the mountains and the city centre as well.  (full of good shops). The Staff always ready to help you for every kind of need, very professional and very polite. The SPA well organised , this year I met a SRI  LANKA masseur very good and skillful. Restaurants with good local food, but you can also have fish. Wine cellar at the Top. The right place to send your best friends. MaxBugatti."
Aug 2016,50,Mountain spa,"The Mandira Spa is a spacial yet intimate place entirely confined within the hotel grounds, well equipped and designed to offer an ultimate relaxation. You can choose between sauna or steam bath, whirlpool or jacuzzi, and lots of holistic treatments like oriental massages and regenerative practices that you can enjoy on your own or with your partner."
Jul 2016,40,Great base for mountain bike trips,"We have been to Lac Salin several times, first time more than 10 years ago, still a nice place with great service and good spa, but this last time we noticed that it might need a renovation soon to keep up with the trend. The spa is well run also with beauty services on a very good level."
Jul 2016,50,Cartrip,"Very nice place with exellent food and service. Looking forward to our next visit. Such a nice mountaintown to walk around in, before getting back to this beautiful hotel. Everything as expepted. 1class charging facilities for Tesla as well."
Apr 2016,40,A High Quality Hotel in a Great Location,"We booked this hotel as part of a NEILSON skiing holiday. It is in a fantastic location right at the side of the nursery slopes and 50 m from where the kids ski schools meet in the morning. Our room was of a high standard with quality fixtures and fittings, our own bathrobes and slippers ( even a smaller one for our 8 year old which he was delighted about). We had a view of the town and the Mottolino ski area from our balcony. My only concern was that it was sold to us by NEILSON as a deluxe family room which had a separate living room area for the 17 and 8 yr old on sofa beds ( as shown even now on the website). Unfortunately when we got there we found that the room we believed we had booked was classed as a premier room which hadn't been an option on Neilson and we were in a much smaller room so we were crammed into a basic sized  room with a sofa bed, not very comfortable for a week and definitely not enough cupboard space for all of our kit. Despite this the high standards of our hotel allowed us to relax quickly especially with a glass of wine on the terrace watching the beginners and children. The food in the restaurant was of a very high standard so much so that for a couple of nights we ate in town so that the kids could ir preferred food! Our waitress, Erica was lovely and couldn't do enough for us. The spa was very good and the sports massage I had to have after a few days hard skiing was just the job. The bar was not very busy but very comfortable. The staff were excellent especially Allesso and Marco. The entertainment wasn't brilliant but as their were not many in it didn't really matter. the skiing was excellent though we were lucky with the weather, there are two ski areas, the Mottolino area and the Carosello which was at the back of the hotel but are mainly reds with a few blacks but they are easy reds compared to French ones! The food and drink were very decently priced for mountain restaurants as was the town itself which was tax free. It was a long transfer to the resort from Innsbruck but well worth it."
Mar 2016,40,Best Hotel in Town,"Everything in one place. Ski lifts at your door. Friendly staff, great rooms, cool apres ski on the patio. Highly recomend this charming hotel, not too small not too big. Easy walk into the village.must go."
Mar 2016,50,Excellent Hotel,Hotel Is located Via saroch near to carosello.very luxury hotel.rooms are very beautiful.Livigno is very famouse for sking at the winter season.summer very good for mountain climbing.january so cold to me.but resturants/room facilities/Cleaning are at very high standerd.i love livigno also hotel lac salin
Mar 2016,30,Something changed......,We have been coming to this resort for 4 year but over the last two years the quality has gone down especially in relation the food served. It is like something is missing the the something that gave it the hotel the 4+ . Overall the service is High and the rooms are great.Hope that the food Will change to the better again
Feb 2016,50,Counting down the days,"We are counting down the days....Within a few week it will be our seventh visit to this very nice hotel, which our kids almost see as their second home. Lac Salin has an excellent location at the end of the village but right on the slopes. The rooms are large and well-equipped. The ski hire in the hotel is convenient and gives an excellent service. Friendly service and kind staff. The manager is always making sure everything is running smoothly. Great bar and restaurant with friendly and attentive customer service especially from manager Ignazio, waiter Danieli and bartender Alessio."
Feb 2016,40,Nice Hotel in beautiful Livigno,"This hotel is very nice and cosy. The service and the hospitality of the staff is impecular. It is located in the upper part of livigno so you can walk down the main road and do all the shops, bars and restaurants. Their spa and the massages are very good as well"
Feb 2016,50,Excellent hotel in good ski resort,"Loved this hotel. The staff are excellent. Lovely welcome on arrival, early check in to accommodate our wish for half day skiing.  Restaurant staff as mentioned all lovely, helpful & attentive. Also housekeeping; came around in the evening to change towels & turn down beds as well as during the morning. Spa pool is very much that not a swimming pool which is why I guess they discourage young children. Always lovely quiet place with great atmosphere to relax in after your swim. Food: so much choice morning & evening & all really tasty - hats off to the chef! If I were to mention any negatives, & they really are v small, bath towels could do with being bigger (& a bit fluffier!) & the bar in the evening could have been designed to be warmer & more welcoming.  We found it chilly & not very well used.  But those are minor observations, I will definitely be coming back to the hotel.  Livingo suffered from a lack of snow, mainly off piste, but the snow was still good on piste even on the very warm days (8 degrees skiing in January?? Come on!) didn't turn to slush as in other resorts.  Good skiing on both mountains, easy to use the buses to get to & from the other side of the resort.Flew into Innsbruck, @ 2/3 hours from there. But worth the journey."
Jan 2016,50,Amazing service and first class ski gear rental,"We had a lovely stay, the staff were always helpful and very polite. We paid for half board and the breakfast and supper options were varied, interesting and definitely worth it. The included spa options (sauna, pool, steam room etc.) were a daily post ski indulgence. I would like to mention the ski gear rental especially. The man in charge was friendly, helpful and the costs (with on the spot discounts) were cheaper than any of the prebooked gear rentals I could find. I broke a ski pole which he replaced free of charge and he swapped out boots for those of us who needed it until we were all happy.What a great stay. A bit rough with the unexpected Rand/Euro exchange free fall but still worth it.The hotel allows 30 days pre booking date 100% refund so if you book and feel the price is currently fair, pay in full to avoid later disappointment. You can always cancel later."
Jan 2016,50,Beautiful Hotel with everything you could ask for.,"Large room with every ammenity possible,great views of the mountains and the village. The staff were friendly and always very helpful. The meals were sumptuous and generous with extraordinary spreads for both breakfast and evening meals.Ski hire was available within the hotel itself , making it easy and convenient"
Jan 2016,50,Excellent choice for a winter break,"Visited in January, two of us and an 8-year old kid. Modern, spacious room, with a small balcony overlooking the slopes. Large bathroom. A king-sized bed, and a sofa for the kid. Heaters are large to dry your clothes. TV -- smallish. The only minus about the room is that there is a glass door in the bathroom into the sleeping area and you can see through it (or if the light is on, it may bother you). No coffee machine or tea kettle.Very good breakfasts -- all the usual basic things you might want. A bottle of wine is available in the mornings for those craving.Dinners -- very good, service is attentive, wine list -- extensive. 2-3 menu options every day. There is also a gourmet restaurant -- excellent service and slightly better food for a 15+euro per person.Hotel staff go out of their way to please you, service is excellent.Wifi is free, but is slow.The swimming pool is large and has an adjacent jacuzzi. There are several saunas -- finnish, steam and herbal, showers and ice room. Only minus -- they don't allow kids younger than 14 (for unclear reasons) -- but if you are careful, you can sneak your kid in.The hotel has its own ski rental/storage and is located 50 meters away from the lifts to the slopes and a ski passes shop.It takes about 4 hours to get to the hotel by taxi from Milan (at 450 euros) or you can take a taxi to Tirano (1.5 hours and 110 euros) and then 2.5 hours by train to Milan.Livigno is a large village with lots of shops to walk about in the evenings. Lots of sports shops, there are several apre-ski bars in the central area. The central area is much livelier than the part where Lac Salin stands (but it takes 15 minutes walk to get to the center or about 5 min by taxi -- 10 euros on average)."
Dec 2015,50,Excellent,Best holiday of my life. Most excellent and friendly service. Family friendly. The heated pool after a hard day of skiing is perfect for the sore body. Thanks to the staff for making our holiday a pleasurable one. Thanks to Nicola for his patience on the slopes. He is the best instructor out there.
Sep 2015,50,Stuck in the snow on two wheels,"Was on my way to the stelvio pass on my motorbike after getting over the swiss Furka & Julier pass,  and the Bernina pass over to Italy, decided to stay in Livigno as the weather was bad, it got worst when I saw the snow in the morning, no go on two wheels, so extended my stay at the Lac Salin, after all Euro 94 incl diner & Breaky in a 4 stars hotel isn't a bad deal at all, the place breathes luxury, comfort & warmth with all amenities, lockup garage ect .... I recommend the top 3rd floor for quietness, the floor between 2nd & first, 3rd & second are of a wood type and you can hear people above if they are noisy or of the heavy steps type, I had a family with kids above me and had to ask to change to a higher room ......haven't tried the wellness & spa yet but will for sure, apart from that its faultless, service, amenities, food ect ..... they seem to be cheaper at the reception than on the web though .... just hoping for the snow to stop so I can get going on my two wheels again  ...."
Sep 2015,50,Anniversary ,"LAC SALIN Spa. Always OVER the Top. Kindness is the word to use for all the Staff,I really say for all the staff. Restaurants inside the Hotel very good. Very Clean Hotel. I am sure One of the BEST. From there you can reach easily the city centre and by cable car you can go ( must go) to Carosello 3000 near the beautiful Lac Salin little lake up there. Do not miss this experience. max."
Aug 2015,50,passion to please the guests !,"We were in Lac Salin for 8 days and from the beginning to the end the whole staff (in special Sergey in resto, Allessio in the bar and Mr Giacomelli in general) are always listening to their guests and if any small remark or question to try to solve very quickly !! But also the whole staff from welcome till the end is very helpfull.The room was very nice and spacious and clean. The restaurant serves various and very good food (special the antipasta buffet & dessert buffet). Extensive winelist at good prices. The hotel is situated at the end of the village, so you have a very nice view on the Forcola side. we recommend this hotel and we will for sure go back (it seems the ski area is nice !)"
Jul 2015,50,Livigno....not just a ski resort!!,"Just back from a memorable holiday in the Lac Salin Resort in Livigno. What a hotel!! The welcome, style, friendliness, ambiance was excellent. The restaurant and its food were out of this world. Wonderfully managed by Ignazio, his catering team produce meals of the highest quality and presentation. So Livigno for snow and sun and Lac Salin for all year round excellence."
May 2015,40,Ski holiday,"Excellent location 10 m to the lift for skiing just by the bar,food fantastic we were half board but with the restaurants in the area area so good and well priced we would do 1 week half board and eat out for the second skiing is great for all ages we had a instructor for our daughter he really kept her interested and focused for 2 weeks which takes some doing the central ski school in town the advantage of being 5 mins walk from town is you are in the old part great restaurants by you that if you stay in the main part you would never see for the very advanced probably not the best resort but for great big mountain skiing huge wide slopes even on half term not too busy until about 2 in the afternoon because the area is tax free staying here isn't crazy money like a lot of other resorts but the après is great have been on a lads week and family holiday and caters for both I would recommend the dog sledding it's crazy The hotel are very helpful great staff pool ans sauna are great plent of room the spa for massages etc is excellent even giving children 20 minute massage my daughter loved it as a treat would stay again"
Apr 2015,50,Italy in the mountains,What a wonderful surprise Positano in the mountains a rare place to relax with skiing things to to do especially shopping not least bike riding dog sledging tobogganing amazing views officially breathtaking stars
