Mar 2015,50,Best hotel in Livigno,"Very nice overal expierence, but need little refubrishing in the rooms. Returning customer for 10yrs. Top quality restaurant and personal - Chief and Manager of the resaurant Ignasio. Perfect bar and Spa with amnities."
Feb 2015,50,Fantastic,"We spent 3 days here with Lamborghini ice driving experience. The staff and attention to detail where great, the manager talked us in on phone from lake Garda and given us advice on best way back to UK. The spa was good, the herb and steam were not working one day which was probably the only niggle. We didn't have time to experience the ski in facilities but it's just at end of slope. Would recommend and would live to come back the whole village is lovely"
Feb 2015,50,Winter magic,"We just recently spent 12 nights at the wonderful Lac Salin Spa and Resort in Livigno.  Everything from the wonderful, accommodating staff to the rooms, food, and facilities were superb.There is an in hotel ski hire office with very competitive rates and they also offer private and group ski lessons through their in house ski instructors.  We used both these services and it was very convenient and the instructor was a gem.There is a kiddies ski school right outside the hotel and they offer group and private lessons which are great for 1st timers (like us) or for the experienced skier.Although the hotel is about 2kms from central Livigno, its a very easy and pleasant walk to everything.The hotel also offers free wifi everywhere and there's an indoor heated pool, jacuzzi, gym, steam room and sauna available to all guests which was great to use everyday after spending the day outside on the snow.I wouldn't hesitate for a minute in recommending Lac Salin Resort to anyone and we will definitely be back for another winter holiday."
Jan 2015,50,Fantastico!,"We stayed at Lac Salin as a family with two teenage kids between Christmas and New Year.  The staff were professional and friendly. The ""in house"" ski rental and quick walk to a ski lift made for a pleasant skiing experience.  The restaurant food was of the highest quality with attentive staff.  The Spa was a treat with all the saunas, jacuzzi and relax rooms included.  We would highly recommend this hotel.  The hotel management were always present and eager to please.  We had a fantastic New Year's Eve Party with great entertainment."
Jan 2015,50,Wonderful,"Our stay at Lac Salin was over Christmas week as a couple for skiing. Though the snow was alittle disappointing the skiing was still fine up in the higher areas. Christmas meant the hotel was probably filled with more families than usual, but did not interfere with our stay at all and looked like an excellent place to bring the family with the ski school slopes directly outside the hotel. Special Santa visit on Christmas eve was very sweet...though I am happy not to hear another Christmas carol for at least another 300 odd days!Staying at Lac Salin meant there were many other wonderful things to do. Access to the extensive Spa area was free and available most of the time - interesting sauna rooms (turkish/steam/herbal) a small gym, good sized pool, spa etc etc.We had the cheapest room which was still extremely generous size, wonderful bath and very clean and comfortable and balcony over the slopes.Our stay included Breakfast and dinner which was served in the large dining room with buffet and menu choices and a wonderful wine list, each night's choices were different, the high quality food was interesting and delicious.Far and above the thing that made our stay so special and why we will return was the friendly, professional staff in all areas. Special mention to the friendly and helpful - Paulo, Vitaly, Blessing and Milos."
Dec 2014,50,Perfect summerstay in the mountains,"Very high quality hotel with perfect resturant and good relaxation. We stayed in a 2 floor familyroom with terrace facing the city, which is perfect with kids. Stayed there for a whole week which was NOT a bit to long - lot of fun activies for the whole family. We experienced 20 degrees and snow in that week. For skiiers and other mountain lovers this is a must experience hotel."
Oct 2014,40,Hotel Lac Salin old fashioned italian family hotel,"This hotel calls up very different emotions.Location is on the slopes of the piste of Livigno, great location, little bit outside the to busy city centre.Rooms are very good, nothing to complain, nice balcony, nice view on the slopes.Entrance is not very nice, there is not such a thing as a pleasant lobby! The restaurants are ok, very good service, very traditional set up of tables, reasonable Italian food. The decor you might call very attractive for Russian's, but for our taste, a little bit to much glitter.Apart from this a very nice indoor swimming-pool, with a very good spa, definitely a recommendation!Overall a very nice family hotel, good location and reasonable good food.Only one thing, Livigno ski area is divided in two pieces because of the valley. Unfortunately you can not ski from one side to the other, you have to make a choice every day where to ski!"
Sep 2014,50,"Very nice, modern hotel","Very modern hotel, excellent service, great buffet breakfast. We really enjoyed the swimming pool and the spa facilities in general. Upon arrival we received a welcome drink, which was very nice. I am sure we will go back to this hotel in the future."
Sep 2014,50,4 th Honeymoon with the same wife. (32) years.,"After many years, I always discover Lac Salin Hotel more& more beautiful and resourceful.Of course I am talking about aTop Hotel with restaurants inside  managed by mr. Ignazio very professional, besides, you'll find a wonderful SPA. Very Very good for relaxing mind& body. Very clean with a Staff always ready to Help you. All my good friends have already tried IT, and they are ALL happy.      max.Molto molto valido, da consigliare al tuo migliore AMICO."
Aug 2014,40,Best place in Livigno,We stayed here for a week in the summer time with two kids. The Hotel is very good with very nice facilities and a nice spa/pool area. Good and helpfull service. The 2 level family room is recommendable when you have kids. Food - both breakfast and dinner - is good italian standard. However wines at the wine list are of other vintage than they serves (and this is not mentioned). We are ready for another visit !
Apr 2014,50,Wonderful stay,"We stayed at the Lac Salin Spa and Mountain Resort for our honeymoon. The service was excellent, the rooms were modern and clean and the food at the restaurant was amazing! We chose the half board option which included a four course dinner and were very happy with our decision. There are slopes right next to the hotel where we could have our skiing lessons. The hotel also includes spa facilities which we really enjoyed after a morning of skiing. The staff were very professional and friendly, and went out of their way to make our stay more comfortable. We enjoyed every moment of our time at this wonderful hotel."
Apr 2014,40,Convenient alpine base,"We have stayed at Lac Salin off the main season, so the perspective is a little different. Most of the restaurants and attractions in Livigno were closed, so we were doomed to use the hotel facilities more intensive way. But it was gooood....The restaurant has great ambient (especially the wooden rustic area), the service is just excellent, food exquisite and wine matched properly to the dishes. This was absolutely excellent experience for both dinner and breakfast.Hotel itself is located outside of the Livigno city center, but close to trails leading to the tops of the mountains surrounding the valley. Rooms are compact, but good enough for two people and have nice views to the surroundings (no backyard nightmares). Very clean, but you can smell the chemicals used to keep up. I also would;t like to fit into the room with 2+2 family - it would be too crowdy.Free parking for hotel guests. Free WiFi. Ability to rent the mountain bikes on site.Helpful and smiling reception staff. They have even called us checking if we can find the way to the hotel.Certainly a good place to enjoy a romantic getaway or sporty extended weekend."
Mar 2014,50,Indulgement in Livigno,"Whenever you're going to Livigno and are in for a great time, for sure you have to go to Hotel Lac Salin. The rooms are furbished to perfection as is actually the whole hotel. Breakfast is great, as is diner. The wine-list is extensive with all Italian greats and some mondial as well.Finding a friendlier staff wil give you a hard time.The hotel is ideally located directly at the slopes enabling you to ski directly from your room.Once your muscles are overheated try the spa and swimming pool - they're great!Do yourself a favour and have a look at: www.lungolivigno.comMind you, I'm independent and not on their payroll but enjoyed such a good time that I simply have to share it with you."
Feb 2014,50,Overwhelming,"Excellent service by the entire staff, immaculate rooms, delicious and high quality food.Absolute TOP hotel. This hotel is a must for an absolute perfectly maintained holiday and can compete with the best available hotels in the area."
Feb 2014,50,Amazing,"We went to Livigno for my 50th birthday and my husband enlisted the directors' help to give me the most amazing birthday ever.  Dinner in one of the small dining rooms, flowers...( where they got them I don't know) a beautiful birthday cake and dancing in the bar later.  They really made me feel incredibly special.  The food is wonderful and the service very good.  The rooms are lovely.  We stayed there 3 years ago and spent a lot of time in the spa.  The only problem I found this time was a lot of screaming, undisciplined small children in the spa. The spa area should be for adults or at least no under 12 year olds.  Perhaps aslo seating all parents with small children in one area in the dining room is a good idea.  We will certainly be back."
Jan 2014,40,Fantastic,"Another great week at Lac Salin. Excellent friendly service from everyone from the hotel director to the restaurant waiters, nothing was too much trouble for them. Great food as can be expected from this kind of establishment. Fantastic location and excellent facilities. €10 extra charge for delivery of two teas to the room should be re-considered since there are no tea/coffee facilities in the rooms.Screaming undisciplined children in the dining room and the hotel's SPA our only complaint. Would like to see a little bit more control of kids from the hotel for the benefit of the other guests."
Dec 2013,50,best in Livigno,"Very recomended hotel with great stuff, very good location excellence half board and pet friendly. Garage for car is included. Spa is excelent, clean:-) wifi is free and speed is ok... we were each year in others 4stars hotels in Livigno, but this was best one. The dinner is too late and it was the only one weakness"
Oct 2013,50,Wonderful stay,"We stayed for 1 night in Feeling Room number 2, ""Luna""We were here in the very low season, however everything in the hotel seemed to be open for business.On arrival we were offered a welcome drink of Prosecco that we enjoyed in the comfortable chairs in the lobby while our checkin was processed. After that we were shown to the room. Checkin was efficient and friendly. We were supplied with a discount voucher to use in the restaurant as well as a shopping card that can be used in a variety of the duty free stores in the town.Each of the Feeling Rooms is decorated in a different style/theme. The Luna room was very stylish and modern with a huge ( extremely comfortable) leather bound, King size sleigh bed facing the windows, behind it was a full width wardrobe and behind that is the expansive bathroom area.The bed was the most comfortable one we slept in on our Italian trip, a true King bed, not just two twin size beds pushed together. There is very nice mood lighting throughout the room but the lighting over the bathroom mirror is poor. There was plenty of space on the vanity. There is a huge two person shower witha  rain shower head and the back of the shower is decorated with a huge ""moon"" mirror. Bathrobes are supplied and the towels were nice and plush.The bath looked wonderful, a huge oval free-standing bath and the toiletries supplied were L'Occitane en Provence. As well as the usual shampoo, conditioner, shower gels etc there was also a bag of bath salts and a loofah to use in the tub. I only had one complaint about the bath, the plug is poorly designed, it is right in the middle of the bath and sticks up slightly so can be uncomfortable if you don't carefully avoid it!A proper hair dryer is supplied ( instead of the on-the-wall type). A kettle and tea and coffee making products were supplied in the room which was very welcome, as well as a well stocked mini bar. We enjoyed a drink in the bar before dinner ( very colourful - the lighting in the bar goes through different colours every few minutes) and followed that with dinner in the main restaurant. The meal was delicious, the menu was extensive and included some interesting local specialties and the wine list was huge!  Service in the bar and restaurant was friendly and very attentive. Our wine was served with real panache. We returned to the room to find that housekeeping had provided turn-down service, chocolates, fresh towels etcWe slept very well as the town was so quiet, the only sound was the tinkle of cow bells! We had a lovely view from our room down the valley to the centre of town and up to the mountains. The breakfast buffet was very extensive, we were offered the choice of fried eggs or an omellete and there was also scrambled eggs on the buffet as well as bacon and a wide range of fruits, pastries, cold meats and cheeses, fruits juices etc. The head waiter remebered us from the evening before and gave us a kind farewell when we left - excellent attention to detail!On leaving the hotel we were given a cellophane wrapped gift - a delicious small cake. We were delighted with our choice of hotel and would definitely recommend it."
Sep 2013,50,Nice hotel and spa,"A wonderful vacation and skiingLivigno has never failed. Hotel is very clean and inviting. It is best, however, swimming pool and sauna world. After skiing experience here amazing relax.The food is good and the selection was always sufficient.The hotel can come to ski. The first lift is a few meters from the hotel, so do not need any bus. You can put on ski boots right at the hotel.PROS:+ Swimming pool and sauna world+ Availability to lift+ Nice, clean, comfortable and spacious rooms+ location+ Dishes and a selection of dishes during dinnerCONS:- One of the waiters was very unprofessional. He acted as a director of The Globe and guests are unwelcome. Needlessly destroy the name of the hotel. We hope next time he will not work here. He destroyed the useless experience of our holiday. Other staff was friendly.- Ski room was opened without private lockers- nothing more"
Jul 2013,40,"Great biking hotel, shame about the coffee","We always stay here on our bike trips through Italy. It's a gem by livingno standards, clean, modern, spacious. Has a spa. The big let down is the breakfast coffee - simply awful - and in Italy of all places!"
Apr 2013,40,"very beautyful structure, excellent food and restaurant/bar service; cold welcome at recetion","all perfect except welcome, reception staff is not really professional as I demand for a 4s;excellent kitchen and breakfast buffet, very nice and charm service staff, I love fast service at dinnerComfortable rooms, very clean and housekeeping always ready to fullfill every demand"
Apr 2013,50,Fabulous Hotel,"Arrived after a long car journey from England , had booked a Family Room for myself, my husband and 3 children aged 19,15 and 5 which provided plenty of space and storage !    Everything was very clean and top quality .    We stayed on a HB basis and the breakfast was fresh and plentiful , great coffees and any kind of eggs you wished for cooked to order !   The evening meal 4 or 5 courses was excellent , a real variety of foods , buffet starters, veal, boar, seafood etc and wonderful deserts!   The Maitre d went out of his way to accommodate my 5 year olds limited diet, not easy I can assure you !     The walk from Boot Room to Nursery Slope is about 1 minute and suited us fine , the older ones taking lifts up to the top (3000ft) and skiing back down ..  Spa was excellent and we swam and took saunas every afternoon after skiing .    All in all we couldn't fault the hotel or town of Livigno and will be going back , same time , same place next year !   Looking forward to it already ."
Feb 2013,50,"Great hotel, great people, great location.","Great hotel, great people, great location and this was our second visit. We will definitely go back to this hotel if we decide to go back skiing in Livigno. Some feedback for the management of the hotel is the carpet in the room which they should think of replacing in future as it was somewhat used in our room. However, as the room has partially a wooden floor it is a minor issue."
Feb 2013,40,Very good - but beware the ankle biters,"This is a lovely hotel in the remote part of duty free Italy. The snow was great. The proximity to the lifts super.We had a superior room, South facing (what we booked), but only after we were given a North facing, but equally nice room.The disaster was this was school holidays and the noise of dozens  (literally) of children in the surrounding tables made meal times something to be endured. The hotel was full. On the third last night the maitre d' asked why I was having no desert. I replied I could not endure the noise and parents rocking prams in and out between my wife and my chairs any longer. In fact was taking a plate of dessert items from the dining room.I suggested that couples (which made up about one third) should be given one area and family groups the other area. Simple good hotel keeping. Thinking about the guest experience. Some of the staff were great. Some looked down their collective noses so far it was a wonder they could see past their upper lip.To my surprise, we did get moved and the last meals were much more enjoyable. We were not the only couple to feel this was a problem. One honeymoon couple from Ireland were glad to be leaving for Milan.So avoid school holidays (British, European and East European) ANDAsk for a table away from the kids."
Feb 2013,50,Wonderful place!,"Arrived here after a 400 mile drive from the Nurburgring in Germany, the place is lovely, the room was huge, the staff were very polite and helpful - just what we needed!Great view from our balcony, where we watched an impressive lightning storm in the distance the first night.We originally booked the Concordia but got an email a few weeks before our trip saying we'd been moved. Our fears were unfounded, this place is spot on!Can't get in this year, it's fully booked!Trip was July 2011, not 2012."
Feb 2013,40,Lac Salin probably the best Hotel in Livigno,"Stayed in the Sky suite with a tub in the middle of the room that we used one time only. Otherwise this room was not really a suite more of a large room. No sitting area. We missed that.The hotel is almost brand new and nicely done, the rooms are nice with a good size. The restaurant is very nice, good service and the Maitre D was very effective. Would like to give them 5 stars but can only give 4 because of the location. Its in the middle of the town but Livigno is a quite spread out town and to go back and forth to the slopes you need to take the bus, the bus takes from 10-30 minutes x 2 so you loose about 30-40 min / day riding the bus. Thats a major reason why Livigno cannot reach the highest scores. Otherwise its rather cheap in the town taxfree as it is. Food and restaurants are not expensive so if you are on a budget Livigno can be a good choice."
Jan 2013,50,Pefect as last time,"Our second visit to Lac Salin was pefect as the first time: Excellent service, excellent food and service in the restaurant, and very nice hotel rooms. I will recommend everybody to stay at this hotel!See you next time."
Jan 2013,50,Luxury Hotel right on the slopes,"We went here for a family ski holiday. The hotel is in a fantastic location, plenty of restaurants nearby and literally right on the slopes. You can pretty much walk out the hotel door and onto the ski lift.We had a family type room which had a balcony that looked out onto the ski lift. The room itself was laid out well and very comfortable. I couldn't fault the breakfast, great variety of food and a nice relaxed atmosphere. The staff were also very friendly and helpful.The hotel has a swimming pool and leisure centre which was never too busy. Id recommend coming here after skiing everyday to relax before dinner.All in all I cannot fault this hotel. If I was coming back to Livigno I would try stay here again."
Jan 2013,50,Real great hotel,"Very nice hotel and facilities. A great SPA  with various treatments. A bit pricey. Every day all kind of activities:yoga, guided walks and hiking or biking. Good rooms, well maintained and at high standard. The restaurant, the maitre, the food, are excellent one of the best in the 4*Superior class. the dinner is  gourmet and breakfast is great. service everywhere at the hotel was a top notch. Loved every moment.Will be back"
Oct 2012,50,Excellent,"Coming from a poor hotel in Switzerland, this was a refreshing breath of fresh air. The hotel looks just newly refurbished, although it has apparently been completed 6 years ago! The rooms are modern and maintained to very high standards, and the restaurant is worth one of those famous stars. The wine list is comprehensive, and, better of all, reasonably priced (also thanks to the zero-VAT status of Livigno). The breakfast was sumptuous and the service impeccable. I hope to be back soon!"
Sep 2012,50,September stay in a wonderful hotel,We'd a fantastic stay in the middle of September. The hotel and staff is amazing. The rooms are big and very well kept. The spa is also worth visiting as well. The food and the variety of the food was also very good.
Aug 2012,50,"Lovely hotel, helpful staff, good rooms","The owners of this hotel really do go out of their way to do everything they can to help you.  We had stayed here before and this time booked same day and got last room in hotel.  We arrived late at night and staff were sympathetic that we had been travelling and took us straight to our room waiting for full check in next morning.  Spa is lovely though shame only pool is open in the morning.  Most rooms have balconies and are spacious with good bathrooms.  There are lots of lovely touches like fruit bowl and water on arrival. Breakfast is excellent and we had previously eaten in the evening and that was good too.  All round lovely hotel with add ons like bike hire, spa, yoga and various holistic classes if you have money to burn (they are expensive, but better value and far nicer experience than the outrageous new Aqua Grande Spa in Livigno!)."
Aug 2012,50,"Nice hotel with perfect service, nice rooms and an excellent dinner and breakfast","We paid for one night half pension 226 €. The hotel seems to be new, the rooms and the complete locations has a nice ambience. We were with the bicycles there and it is possible to wash the bike in there own garage further they have a bicycle room in the basement. Further the hotel offers a wash service for your bicycles clothes, you can give your clothes in the late afternoon and you will have it back in the evening, really perfect. They will bring your luggage on the room and you will get a welcome drink after your check in. The room has a little balcony with a nice view. The dinner menu is excellent and the service is perfect, this is far more then standard food, the breakfast is also perfect, a bright range of different food and orange juice is fresh pressed. 2 thumbs up, I'm sure I will come back for some days, despite the high price."
Apr 2012,50,Absolutely top hotel,"Lac Salin is on of the best hotels where I have ever been. Almost everything is perfect!I love their spa, it´s really amazing relax after skiing. Water beds in relaxation room are so good.Rooms are big enough, with huge bath and very comfortable bed.The breakfast is very rich, specialy fresh juice from carrots and apples is great, but everything is good quality.In the skiroom is heating for skiboots, which is very usefull.The location is not exactly in center but not far on foot and what is important, hotel is on the slope, so you have to use ski bus only if you want to go to other side to Motolino.This was our second time and we would like to come back again."
